{
  "schemaVersion": "1.0",
  "enabled": true,
  "status": "confirmed",
  "targetPageIds": [
    "task-list",
    "task-detail"
  ],
  "pageMapSha256": "61efe279de540375ae46987630e1394a2c5379033e212413300ad2e3c61628f7",
  "documents": [
    {
      "pageId": "task-list",
      "title": "任务列表",
      "path": "page-briefs/task-list.md",
      "origin": "generated",
      "openQuestionsResolved": true,
      "status": "confirmed",
      "confirmedBy": "user",
      "confirmedAt": "2026-09-21",
      "confirmationEvidence": "FIXTURE ONLY：虚构案例的模拟确认，用于演示哈希链；不构成真实用户确认，不得复用于新项目。",
      "sha256": "fcc91216311dabc289b1d95a86621a63097f5b556b451ff96166717490e1606f"
    },
    {
      "pageId": "task-detail",
      "title": "任务详情",
      "path": "page-briefs/task-detail.md",
      "origin": "generated",
      "openQuestionsResolved": true,
      "status": "confirmed",
      "confirmedBy": "user",
      "confirmedAt": "2026-09-21",
      "confirmationEvidence": "FIXTURE ONLY：虚构案例的模拟确认，用于演示哈希链；不构成真实用户确认，不得复用于新项目。",
      "sha256": "f472784ca0269dc2ac4c6b6fde494bf2d7b5c6a7c9d0b717fa6fc0a0953cb941"
    }
  ],
  "bypass": null
}
